{
  "job_id": "01jrk8m4q4xv2v8d4d4ymf5xnk",
  "statuses": [
    { "from": "queued",     "to": "claimed",    "controlled_by": "queue",  "at": "2026-04-27T08:14:33.000+08:00" },
    { "from": "claimed",    "to": "processing", "controlled_by": "worker", "at": "2026-04-27T08:14:33.200+08:00" },
    { "from": "processing", "to": "succeeded",  "controlled_by": "worker", "at": "2026-04-27T08:14:37.643+08:00" }
  ],
  "results": [
    {
      "contract_version": "1.0.0",
      "job_id": "01jrk8m4q4xv2v8d4d4ymf5xnk",
      "tenant_id": "01jrk8m4q4xv2v8d4d4ymf5tnt",
      "document_id": "01jrk8m4q4xv2v8d4d4ymf5doc",
      "document_revision": 3,
      "page_id": "01jrk8m4q4xv2v8d4d4ymf5p01",
      "page_number": 1,
      "status": "succeeded",
      "engine": { "name": "paddleocr", "version": "2.7.3" },
      "page_metrics": { "processing_duration_ms": 142 },
      "raw_text": "上海市浦东新区人民法院",
      "blocks": [
        {
          "block_id": "b_0001",
          "type": "heading",
          "text": "上海市浦东新区人民法院",
          "confidence": 0.982,
          "bbox": { "x": 412, "y": 188, "w": 1656, "h": 96 },
          "polygon": [[412, 188], [2068, 188], [2068, 284], [412, 284]],
          "reading_order": 1
        }
      ],
      "partial_failure": null,
      "metadata": {},
      "completed_at": "2026-04-27T08:14:37.643+08:00"
    }
  ],
  "terminal_state": "succeeded"
}
